{
  "$schema": "https://json-schema.org/draft/2020-12/schema",
  "$id": "https://github.com/bemayker/Mantsu-design-system/docs/suite-manifest.schema.json",
  "title": "Mantsu suite manifest, version 1",
  "description": "The landscape a Mantsu frontend renders its navigation rail from. Normative document: docs/suite-manifest.md. This schema is for PRODUCER validation: it sets additionalProperties false so a backend emitting an undefined field fails its own tests. Consumers must not validate with it, because ignoring unknown fields is what lets the contract grow additively.",
  "type": "object",
  "required": ["schemaVersion", "self", "source", "apps"],
  "additionalProperties": false,
  "properties": {
    "schemaVersion": {
      "description": "Major version of this contract. Incremented only by a removal, a rename, a narrowing, or a change of meaning.",
      "type": "integer",
      "const": 1
    },
    "self": {
      "description": "The app that served this response. Always also present in apps[].",
      "$ref": "#/$defs/appKey"
    },
    "source": {
      "description": "core: the landscape came from Core, or this is Core. fallback: Core was never reached, so apps contains only self.",
      "enum": ["core", "fallback"]
    },
    "stale": {
      "description": "True when a relay is serving its last good copy because Core is unreachable right now. Absent means fresh. Never true together with source fallback: there is nothing cached to be stale.",
      "type": "boolean"
    },
    "suite": {
      "description": "Suite-wide links. Present exactly when core is in apps[], because both targets live in Core.",
      "type": "object",
      "required": ["dashboardUrl", "settingsUrl"],
      "additionalProperties": false,
      "properties": {
        "dashboardUrl": { "$ref": "#/$defs/absoluteUrl" },
        "settingsUrl": { "$ref": "#/$defs/absoluteUrl" }
      }
    },
    "apps": {
      "description": "The landscape, ordered by order ascending. Never empty: self is always in it.",
      "type": "array",
      "minItems": 1,
      "items": { "$ref": "#/$defs/app" }
    }
  },
  "allOf": [
    {
      "$comment": "source fallback means Core was never reached, so there can be no Core to link to and no second app to list.",
      "if": { "properties": { "source": { "const": "fallback" } }, "required": ["source"] },
      "then": {
        "properties": {
          "apps": { "maxItems": 1 },
          "stale": { "const": false }
        },
        "not": { "required": ["suite"] }
      }
    }
  ],
  "$defs": {
    "appKey": {
      "description": "Closed set, equal to the appKey Core publishes in the role catalogue. A sixth app is a schema change, not a configuration change.",
      "enum": ["core", "cockpit", "downtimes", "lists", "reporting"]
    },
    "absoluteUrl": {
      "type": "string",
      "format": "uri",
      "pattern": "^https?://"
    },
    "app": {
      "type": "object",
      "required": ["key", "name", "icon", "url", "order"],
      "additionalProperties": false,
      "properties": {
        "key": { "$ref": "#/$defs/appKey" },
        "name": {
          "description": "Display name as configured. Not translated: these are product names.",
          "type": "string",
          "minLength": 1
        },
        "icon": {
          "description": "An icon key the consumer maps to a component, never markup. An unknown key renders a generic glyph rather than failing.",
          "type": "string",
          "minLength": 1
        },
        "url": {
          "description": "Public origin in this environment, without a trailing slash.",
          "type": "string",
          "format": "uri",
          "pattern": "^https?://[^/]+(/[^/].*[^/])?$"
        },
        "order": {
          "description": "Rail order, ascending. Configured rather than derived. Ties break on key.",
          "type": "integer"
        },
        "nav": {
          "description": "The app's own rail items. Phase 2; absent in phase 1.",
          "type": "array",
          "items": { "$ref": "#/$defs/navEntry" }
        }
      }
    },
    "navEntry": {
      "type": "object",
      "required": ["key", "label", "path", "group"],
      "additionalProperties": false,
      "properties": {
        "key": {
          "description": "Stable per app, unique within that app's nav.",
          "type": "string",
          "minLength": 1
        },
        "label": {
          "description": "Both languages, always: the rail has no fallback language.",
          "type": "object",
          "required": ["en", "nl"],
          "additionalProperties": false,
          "properties": {
            "en": { "type": "string", "minLength": 1 },
            "nl": { "type": "string", "minLength": 1 }
          }
        },
        "path": {
          "description": "Path within that app, appended to the app's url.",
          "type": "string",
          "pattern": "^/"
        },
        "group": {
          "description": "configuration renders under the inert Configuration subtitle; null is an ordinary sub-item. Explicit rather than optional, so a producer that forgets it fails instead of silently moving an item out of Configuration.",
          "enum": ["configuration", null]
        }
      }
    }
  }
}
